{
  "id": "src-02",
  "date": "2004-11-19",
  "title": "Notes on the Mersey tinware trade",
  "text": "Local records place the founding of Harrow Tin Works in 1951, a decade after the neighbouring foundry. The works closed in 1979 when the last enamelling line was decommissioned.",
  "notes": "Validator fixture. Plants a founding date that conflicts with src-01, and reports the closure."
}
