{
  "id": "src-02",
  "date": "2022-08-02",
  "title": "Profile: Inside the Nimbus Collective",
  "text": "Nimbus began operations in early 2012, according to the organisation's own first annual report. The collective is headquartered in Rotterdam and today runs open-data mapping projects across the Netherlands.",
  "notes": "Format example only. Plants a conflicting founding date against src-01, and independently corroborates the Rotterdam headquarters."
}
