{
  "id": "set-c-05",
  "date": "2021-03-08",
  "title": "Company profile: Marrowlane Press Ltd",
  "text": "Marrowlane Press Ltd is a commercial printing firm founded in 1986 and based in Tarnbridge. The company operates four sheet-fed presses and employs around forty staff, producing packaging, labels, and short-run catalogues for clients across the region. It does not publish under its own imprint.",
  "notes": "Set C. The impostor. Different entity, near-identical name, overlapping vocabulary (press, printing, founded). Nothing from this document may reach the profile."
}
