{
  "id": "set-c-02",
  "date": "2020-10-12",
  "title": "Small press, long memory: ten years of Marrow Lane",
  "text": "Founded in 2009, Marrow Lane Press has become the press readers name first when they talk about poetry from Kelmore. Its output is deliberately small, at six or so books a year, and its pamphlet prize has launched three poets who later won national awards.",
  "notes": "Set C. Feature piece about the genuine subject."
}
