{
  "id": "set-c-03",
  "date": "2022-02-17",
  "title": "\"Six books is enough\": Marrow Lane Press on staying small",
  "text": "We started in 2009 above a bakery in Kelmore and we are still in the same two rooms. Six titles a year is what two editors can edit properly. The pamphlet prize costs us money every year and we run it anyway, because it is how we find the next collection.",
  "notes": "Set C. Interview with the genuine subject."
}
